{
  "@context": {
    "@base": "https://elian0609.github.io/sensado-vehicular/id/",
    "sosa": "http://www.w3.org/ns/sosa/",
    "xsd": "http://www.w3.org/2001/XMLSchema#",
    "proy": "https://elian0609.github.io/sensado-vehicular/vocab#",
    "property_name": "@id",
    "unit": "proy:defaultUnit"
  },
  "@type": "sosa:ObservableProperty",
  "property_name": "low_pulse_occupancy_ratio",
  "unit": "ratio_0_1"
}
